{
  "schema_version": 1,
  "name": "log_linear_attention",
  "kind": "complete_model_graph",
  "source": {
    "comparator": "benchmarks.comparators.fla_k2",
    "notes": "arch-009 (A4 hierarchical chunks). Log-linear attention: a hierarchy of dyadic level states with per-level scales — H = Σ_level exp(segsum(g)) ∘ mask_level, o = (H ∘ qkᵀ)·v. NOT a softmax mask (H can be 0/negative); a linear-attention-like full-matrix form distinct from the canonical single-state K2 law (sweep verdict). The hierarchical construct_H_matrix/segsum/level-mask construction is the typed transform; level_scales frontend and the streaming/chunked partial-chunk state (LogLinearAttentionState) are residual. Verified against fla/ops/log_linear_attn/naive.py @ 864a87f6. Layer module: architectures/log_linear_attention.py."
  },
  "layers": [{"id": "log_linear_layer", "operation": "linear_delta_state", "external_component": "architectures.log_linear_attention.LogLinearAttentionLayer", "params": {"axis": "A4 hierarchical: dyadic level states + per-level scales (full-matrix reference form)", "external_stages": ["level_scales frontend", "streaming/chunked partial-chunk state carry"], "note": "hierarchical K2 level state, not single-state"}, "state": {"levels": "one [K,V] state per dyadic level"}, "cache": {}}],
  "coverage": {"level": "generic_model_integration", "validated": true, "notes": "Parity vs the pinned naive_log_linear_attn (fp32) in tests/test_architectures_a4.py; the hierarchy-active invariant (level scales affect output); gradients. The chunked streaming kernel and partial-chunk state are residual, not claimed."}
}
