{
  "schema_version": 1,
  "name": "mamba",
  "kind": "complete_model_graph",
  "source": {
    "comparator": "benchmarks.comparators.mamba",
    "notes": "arch-043 Mamba-1 + arch-044 Mamba-2/SSD (A8 read/write coupling). Mamba-2's scalar-per-head transition maps EXACTLY onto the canonical additive K2 law (gate_scope=head, delta=False, state M[dstate, head_dim]) and its recurrent core executes through the PUBLIC head-gated matrix K2 path (Mamba2K2Layer) — verified against the pinned ssd_chunk_scan_combined_ref (1.8e-7) and the diagonal scan (0.0). Mamba-1's diagonal gate exp(dt_d·A_{d,n}) varies over BOTH state dims and does NOT fit LinearDeltaSpec (channel gate decays only the key axis); admitting it needs a new elementwise diagonal-affine law, a single-client physical branch — residual per the two-client rule (Mamba1Layer/Mamba2Layer keep the external diagonal-scan reference). The δ/B/C/A discretization frontend, D·u skip, z gate, conv and the Mamba-2 chunked semiseparable kernel are external. Layer modules: architectures/mamba.py."
  },
  "layers": [
    {"id": "mamba1_layer", "operation": "linear_delta_state", "external_component": "architectures.mamba.Mamba1Layer", "params": {"axis": "A8 read/write coupling: selective diagonal SSM (input-precomputable coefficients)", "external_stages": ["δ/B/C projections", "A discretization", "D·u skip", "z gate", "conv"], "note": "per-channel diagonal vector state [D,N]; external reference only — diagonal gate fits no LinearDeltaSpec scope"}, "state": {"x": "[D, N] per channel"}, "cache": {}},
    {"id": "mamba2_layer", "operation": "linear_delta_state", "external_component": "architectures.mamba.Mamba2K2Layer", "params": {"axis": "A8 read/write coupling: scalar-per-head transition = canonical additive K2 (gate_scope=head); recurrent core via PUBLIC K2", "external_stages": ["Mamba-2 frontend (dt/B/C/A discretization)", "D·u skip", "z gate", "conv", "chunked semiseparable kernel"], "note": "state M[dstate, head_dim]"}, "state": {"M": "[dstate, head_dim] per head"}, "cache": {}}
  ],
  "coverage": {"level": "generic_model_integration", "validated": true, "notes": "Mamba-1 external diagonal-scan parity vs the pinned selective_scan_ref (0.0); Mamba-2's PUBLIC head-gated K2 core vs the pinned ssd_chunk_scan_combined_ref (1.8e-7) and the diagonal-scan layer (0.0); layer composition + gradients in tests/test_architectures_mamba.py. Residual, not claimed: the Mamba-1 elementwise diagonal-affine law (single-client physical branch), the selective frontend, D·u/z gate/conv, and the Mamba-2 chunked semiseparable native schedule."}
}
